[
  { "id": "e_0001", "trigger": { "minTurn": 1, "requires": "NONE" }, "headline": "새 학기 문의가 빠르게 늘었다", "effect": { "applicants": 0.1 }, "weight": 10 },
  { "id": "e_0002", "trigger": { "minTurn": 2, "requires": "NONE" }, "headline": "상담 후기가 잔잔히 퍼졌다", "effect": { "reputation": 2 }, "weight": 9 },
  { "id": "e_0003", "trigger": { "minTurn": 3, "maxTurn": 6, "requires": "NONE" }, "headline": "시설 보수 일정이 갑자기 잡혔다", "effect": { "cash": -5 }, "weight": 8 },
  { "id": "e_0004", "trigger": { "minTurn": 1, "requires": "REPUTATION_BELOW_40" }, "headline": "차분한 안내가 불안을 누그러뜨렸다", "effect": { "reputation": 3 }, "weight": 10 },
  { "id": "e_0005", "trigger": { "minTurn": 2, "requires": "REPUTATION_BELOW_40" }, "headline": "세심한 상담이 이탈을 붙잡았다", "effect": { "churn": -0.05 }, "weight": 9 },
  { "id": "e_0006", "trigger": { "minTurn": 3, "requires": "REPUTATION_BELOW_40" }, "headline": "회복 소식에 문의가 다시 늘었다", "effect": { "applicants": 0.08 }, "weight": 8 },
  { "id": "e_0007", "trigger": { "minTurn": 1, "requires": "REPUTATION_ABOVE_60" }, "headline": "좋은 소문이 다음 반까지 번졌다", "effect": { "applicants": 0.12 }, "weight": 10 },
  { "id": "e_0008", "trigger": { "minTurn": 2, "requires": "REPUTATION_ABOVE_60" }, "headline": "수업 후기가 연달아 호평을 받았다", "effect": { "reputation": 2 }, "weight": 9 },
  { "id": "e_0009", "trigger": { "minTurn": 3, "requires": "REPUTATION_ABOVE_60" }, "headline": "추가 등록이 운영에 숨통을 틔웠다", "effect": { "cash": 5 }, "weight": 8 },
  { "id": "e_0010", "trigger": { "minTurn": 1, "requires": "CASH_BELOW_20" }, "headline": "비용 조정으로 급한 불을 껐다", "effect": { "cash": 8 }, "weight": 10 },
  { "id": "e_0011", "trigger": { "minTurn": 2, "requires": "CASH_BELOW_20" }, "headline": "긴축 운영에 현장 분위기가 굳었다", "effect": { "reputation": -2 }, "weight": 9 },
  { "id": "e_0012", "trigger": { "minTurn": 3, "requires": "CASH_BELOW_20" }, "headline": "축소 소식에 문의가 잠시 줄었다", "effect": { "applicants": -0.08 }, "weight": 8 },
  { "id": "e_0013", "trigger": { "minTurn": 2, "requires": "SHARE_LEADER" }, "headline": "선두 소식이 신뢰를 더 끌어올렸다", "effect": { "reputation": 2 }, "weight": 10 },
  { "id": "e_0014", "trigger": { "minTurn": 4, "requires": "SHARE_LEADER" }, "headline": "안정된 운영에 재등록이 이어졌다", "effect": { "churn": -0.04 }, "weight": 8 },
  { "id": "e_0015", "trigger": { "minTurn": 1, "requires": "SHARE_LAST" }, "headline": "새 안내 방식에 문의가 되살아났다", "effect": { "applicants": 0.1 }, "weight": 10 },
  { "id": "e_0016", "trigger": { "minTurn": 3, "requires": "SHARE_LAST" }, "headline": "수업 재정비가 성적 흐름을 바꿨다", "effect": { "grade": 0.08 }, "weight": 8 },
  { "id": "e_0017", "trigger": { "minTurn": 1, "requires": "NO_BID_LAST_TURN" }, "headline": "신중한 선택이 지출을 아꼈다", "effect": { "cash": 5 }, "weight": 10 },
  { "id": "e_0018", "trigger": { "minTurn": 3, "requires": "NO_BID_LAST_TURN" }, "headline": "조용한 시장에 관심이 잠시 식었다", "effect": { "applicants": -0.05 }, "weight": 8 },
  { "id": "e_0019", "trigger": { "minTurn": 1, "requires": "TOP_CLASS_FULL" }, "headline": "상위반 강사진이 고르게 맞물렸다", "effect": { "grade": 0.1 }, "weight": 10 },
  { "id": "e_0020", "trigger": { "minTurn": 3, "requires": "TOP_CLASS_FULL" }, "headline": "탄탄한 상위반 구성이 화제가 됐다", "effect": { "reputation": 3 }, "weight": 8 }
]
